{
  "$schema": "./part.schema.json",
  "part": "leather_binding",
  "type": "collar",
  "about": "a binding of dark leather thong wound in tight turns under the head (art/parts/axe/trims.png)",
  "kinds": [
    "axe"
  ],
  "model": "models/parts/leather_binding.glb",
  "density_kg_m3": {
    "value": 860,
    "source": "leather, dry 0.86 x 10^3 kg/m^3 (The Engineering ToolBox, Solids - Densities, engineeringtoolbox.com/density-solids-d_1265.html, looked up 2026-10-28)"
  },
  "mass_kg": {
    "value": 0.0154,
    "source": "17.86 cm^3 measured on models/parts/leather_binding.glb by tools/items/part.ts --write, at 860 kg/m^3: leather, dry 0.86 x 10^3 kg/m^3 (The Engineering ToolBox, Solids - Densities, engineeringtoolbox.com/density-solids-d_1265.html, looked up 2026-10-28)"
  },
  "cover_m": [
    -0.02,
    0.02
  ],
  "points": [
    {
      "name": "bore",
      "type": "bore",
      "at": [
        0,
        0,
        0
      ],
      "dir": [
        0,
        1,
        0
      ],
      "size": 0.03
    }
  ],
  "centre_m": [
    0,
    -0.00026,
    0
  ],
  "bounds_m": [
    [
      -0.01972,
      -0.02,
      -0.01972
    ],
    [
      0.01972,
      0.02,
      0.01972
    ]
  ]
}
