{
  "$schema": "./part.schema.json",
  "part": "broad_axe_head",
  "type": "axe_head",
  "about": "a wrought-iron broad head, a tall flared bit on a short square poll (art/parts/axe/heads.png)",
  "model": "models/parts/broad_axe_head.glb",
  "points": [
    {
      "name": "eye.lower",
      "type": "eye",
      "at": [
        0,
        0,
        0
      ],
      "dir": [
        0,
        1,
        0
      ],
      "size": 0.03
    },
    {
      "name": "eye.upper",
      "type": "eye",
      "at": [
        0,
        0.01725,
        0
      ],
      "dir": [
        0,
        1,
        0
      ],
      "size": 0.03
    },
    {
      "name": "edge.lower",
      "type": "edge",
      "at": [
        0.00082,
        -0.07025,
        -0.05707
      ],
      "dir": [
        0,
        0,
        -1
      ]
    },
    {
      "name": "edge.upper",
      "type": "edge",
      "at": [
        0.00256,
        0.08861,
        -0.05739
      ],
      "dir": [
        0,
        0,
        -1
      ]
    }
  ],
  "centre_m": [
    0.0008,
    0.01081,
    -0.02397
  ],
  "bounds_m": [
    [
      -0.02382,
      -0.07025,
      -0.07024
    ],
    [
      0.02504,
      0.08861,
      0.026
    ]
  ],
  "volume_m3": {
    "value": 0.00015036,
    "source": "measured on models/parts/broad_axe_head.glb by tools/items/part.ts --write"
  }
}
